{
  "schema_version": 1,
  "message_id": "4e5f6071-8293-4e0f-9a1b-2c3d4e5f6071",
  "message_type": "payment.hosting_entitlement_ended.v1",
  "occurred_at": "2026-10-24T09:30:00Z",
  "correlation_id": "pay-evt-20261024-0001",
  "project_id": "5f0c2a8e-7c1b-4d2e-9a3f-1b2c3d4e5f60",
  "event_key": "pay-evt-20261024-0001",
  "reason": "trial_ended"
}
